{
  "candidate_id": "CAND-0001",
  "detected_at": "2026-05-21T01:20:00Z",
  "source_id": "ftc-ai-enforcement",
  "source_url": "https://www.ftc.gov/news-events/topics/competition-consumer-protection-ai/mock-case-1",
  "title": "FTC Investigates Synthetic AI Hiring Platform for Algorithmic Adverse Impact",
  "date_published": "21 May 2026",
  "detected_keywords": [
    "algorithmic bias",
    "hiring software",
    "employment software"
  ],
  "preliminary_case_type": "enforcement",
  "jurisdiction": "US",
  "source_tier": "green",
  "confidence_score": 0.95,
  "dedupe_key": "e3b0c44298fc1c149afbf4c8996fb92427ae41e4649b934ca495991b7852b855",
  "status": "unprocessed",
  "risk_flags": [
    "no_risk_detected"
  ],
  "notes": "SYNTHETIC MOCK RECORD FOR TEST PURPOSES ONLY. DO NOT INCLUDE IN PUBLIC SITE."
}
