{
  "candidate_id": "CAND-0014",
  "detected_at": "2026-05-21T01:15:00Z",
  "source_id": "mock-src-cfpb-04",
  "source_url": "https://mock.gov/cfpb/mock-advisory-underwriting-discrimination",
  "title": "Consumer Alert: Adverse Action Notices in Algorithmic Credit Underwriting",
  "date_published": "21 May 2026",
  "detected_keywords": [
    "synthetic",
    "mock-pipeline",
    "credit scoring",
    "consumer protection",
    "explainability"
  ],
  "preliminary_case_type": "regulator_guidance",
  "jurisdiction": "US",
  "source_tier": "green",
  "confidence_score": 0.95,
  "dedupe_key": "618888d3b834e4442ce4cb8f9d7b455dac470c3f194fa65fd1a76b01f4482c62",
  "status": "mock_candidate",
  "risk_flags": [
    "no_risk_detected"
  ],
  "notes": "SYNTHETIC MOCK RECORD FOR TEST PURPOSES ONLY. DO NOT INCLUDE IN PUBLIC SITE."
}