{
  "candidate_id": "CAND-0013",
  "detected_at": "2026-05-21T01:05:00Z",
  "source_id": "mock-src-cnil-02",
  "source_url": "https://mock.gov/cnil/mock-enforcement-facial-recognition-retail",
  "title": "Enforcement Note: Unlawful Biometric Profiling in Automated Retail Systems",
  "date_published": "21 May 2026",
  "detected_keywords": [
    "synthetic",
    "mock-pipeline",
    "biometrics",
    "facial recognition",
    "privacy"
  ],
  "preliminary_case_type": "enforcement",
  "jurisdiction": "US",
  "source_tier": "green",
  "confidence_score": 0.95,
  "dedupe_key": "799b84979247ff0cc5875f95d611b62f848a697270882e0c352faeef15d4d320",
  "status": "mock_candidate",
  "risk_flags": [
    "no_risk_detected"
  ],
  "notes": "SYNTHETIC MOCK RECORD FOR TEST PURPOSES ONLY. DO NOT INCLUDE IN PUBLIC SITE."
}