{
  "candidate_id": "CAND-0016",
  "detected_at": "2026-05-21T01:00:00Z",
  "source_id": "mock-src-eeoc-01",
  "source_url": "https://mock.gov/eeoc/mock-advisory-automated-hiring-tools",
  "title": "Advisory Note: Assessment of Bias in AI Resume Screening Tools",
  "date_published": "21 May 2026",
  "detected_keywords": [
    "synthetic",
    "mock-pipeline",
    "algorithmic bias",
    "hiring software",
    "employment software"
  ],
  "preliminary_case_type": "regulator_guidance",
  "jurisdiction": "US",
  "source_tier": "green",
  "confidence_score": 0.95,
  "dedupe_key": "e226c5105bedb4ad20a861a5a03793ce49ff0741462a44db6cab0fc51c6fb2a7",
  "status": "mock_candidate",
  "risk_flags": [
    "no_risk_detected"
  ],
  "notes": "SYNTHETIC MOCK RECORD FOR TEST PURPOSES ONLY. DO NOT INCLUDE IN PUBLIC SITE."
}